{"schemaVersion":"2.0","stateId":"state_wait","runId":"run_wait","scope":{"tenantId":"tenant_1","actorId":"actor_1","visitorId":"visitor_1","projectId":"project_1","threadId":"thread_1"},"stateRevision":2,"checkpointRevision":2,"fencingToken":1,"inputRevision":0,"steeringRevision":0,"lastAppliedCommandSeq":0,"currentNode":"interrupt_for_clarification","nextNode":"classify_intent","pendingClarificationRef":"clarification_1","pendingApprovalRef":null,"cancelRequested":false,"intentRef":"intent_1","briefRef":null,"planRef":null,"draftRef":null,"draftRevision":null,"verifiedDraftRevision":null,"responseRef":null,"budget":{"deadlineAt":"2026-07-26T22:00:00Z","modelCalls":{"max":1,"used":0,"reserved":0,"remaining":1},"inputTokens":{"max":1,"used":0,"reserved":0,"remaining":1},"outputTokens":{"max":1,"used":0,"reserved":0,"remaining":1},"costUsd":{"max":"0.01","used":"0","reserved":"0","remaining":"0.01"},"planRevisions":{"max":1,"used":0,"reserved":0,"remaining":1},"searchQueries":{"max":1,"used":0,"reserved":0,"remaining":1},"pageReads":{"max":1,"used":0,"reserved":0,"remaining":1},"toolCalls":{"max":1,"used":0,"reserved":0,"remaining":1},"parallelTools":{"max":1,"used":0,"reserved":0,"remaining":1},"wallTimeMs":{"max":1000,"used":0,"reserved":0,"remaining":1000},"exhausted":false},"usage":{"currency":"USD","modelBreakdown":[],"toolBreakdown":[],"totals":{"modelCalls":0,"toolCalls":0,"searchQueries":0,"pageReads":0,"inputTokens":0,"outputTokens":0,"totalTokens":0,"reasoningTokens":0,"peakParallelTools":0,"elapsedMs":0,"estimatedCostUsd":"0","actualCostUsd":"0","possibleDuplicateCostUsd":"0"}},"terminalStatus":null,"stopReason":null,"versions":{"contract":"2.0","release":"release_s00","graph":"graph_v2","prompt":"prompt_v1","model":"deepseek_v4_flash","provider":"deepseek","toolRegistry":null,"parser":"parser_v1","index":null,"evaluator":null},"updatedAt":"2026-07-26T21:00:00Z"}
